,dynasty,super_power,story_type,story
28,唐,瞬间移动,轻松,"

这是一个关于一位唐朝英雄人物的故事。他叫李靖，是一名勇敢的战士，他有一颗坚定的心，他有能力去改变世界。

一天，李靖突然发现自己可以瞬间移动，他可以利用这种能力，穿越时空，从唐朝来到了现代。

在现代，李靖发现了一种可怕的怪兽，它们正在摧毁人类的家园，李靖决定要去拯救世界。于是，他和奥特曼一起出发，开始了一场激烈的战斗。

李靖利用自己的瞬间移动能力，轻松地击败了怪兽，他们最终成功地拯救了世界，李靖也被人们称作“时空之王”。

李靖的故事受到了很多人的关注，他成为了一个传奇，他的故事也被传唱了很多年，至今仍然传颂不绝。"
29,唐,瞬间移动,轻松,"

这是一个发生在唐朝的故事，有一位叫英雄的勇士，他拥有强大的武力，更有无坚不摧的勇气，曾在许多激烈的战斗中取得胜利，他被誉为唐朝的英雄。

不料，一场大灾难降临，他被一位神秘的老人带到了现代，老人赋予他超能力，让他可以瞬间移动，让他可以在瞬间跨越时空。

英雄利用自己的超能力，轻松击败了怪兽，并且与奥特曼一起打败了怪兽，拯救了人类。他的行动让人们惊叹不已，他也成为了现代的英雄。

英雄的故事从此流传开来，他的事迹被唐朝的人们永远铭记，他也成为了现代的英雄，他的超能力也让人们更加自信，更加勇敢，去拥抱未知的未来。"
30,唐,瞬间移动,努力,"

曾经有一位叫做刘关张的唐朝英雄人物，他拥有着惊人的勇气和智慧。他曾带领着一支军队，让更多的人从暴政的压迫中解放出来。

刘关张穿越到现代，发现自己拥有了一种叫做瞬间移动的超能力，可以在瞬间穿梭于世界各地。他知道，他有责任用这种力量去帮助世界。

于是，刘关张开始和奥特曼一起，抵抗邪恶的怪兽。他们在各地展开了一场激烈的战斗，刘关张用自己的瞬间移动能力，让怪兽无处可藏，最终，他们成功地打败了怪兽，拯救了世界。

刘关张的故事，让人们感受到了勇气、智慧和努力的力量，他的精神也激励了更多的人，去坚持自己的信念，去拯救世界。"
31,唐,瞬间移动,努力,"

一位叫做李靖的唐朝英雄，受到了神灵的恩赐，拥有了一种瞬间移动的超能力，可以在瞬间穿越到现代。

李靖在现代发现，这里充满了各种怪兽，他们正在破坏和毁灭着这个世界。他决定要立即行动，和奥特曼们一起抵抗怪兽。

他使用自己的超能力，瞬间穿越到怪兽面前，用自己的勇气和智慧，帮助奥特曼们一起打败了怪兽。

最终，李靖和奥特曼们成功地拯救了这个世界，所有的怪兽都被打败了。李靖也因此获得了众多人民的认可和尊重，成为了一位传奇英雄。

虽然李靖最终回到了唐朝，但他的传奇故事仍然传颂于古今，被人们永远铭记。"
32,唐,瞬间移动,努力,"

这是一个关于英雄梦想的故事。

一位叫做张江的唐朝时期的英雄人物，他拥有着非凡的勇气和智慧，他经常帮助穷人，尤其是儿童，他曾经拯救了一个被恶魔抓走的孩子，他也曾经帮助政府打击了一些犯罪分子，他是一个大家都尊敬的英雄人物。

但是，他梦想着有一天能够成为一个真正的英雄，他想要有能力去拯救世界，他渴望拥有超能力，可以去帮助那些受害者，去打败恶势力。

然而，这一切似乎都是不可能的，直到有一天，他突然被一股神秘的力量吸引，他发现自己可以瞬间移动，他可以改变时间，他可以改变空间，他可以改变命运。

张江终于有了超能力，他开始踏上了一条不归路，他自信地走向未知，他决定去帮助奥特曼一起打败怪兽，他开始了他的英雄梦想之旅。

他们一路奋战，在惊心动魄的战斗中，张江用他的超能力，帮助奥特曼一起战胜了怪兽，他们终于成功了，张江也成为了一个真正的英雄，他的梦想也终于实现了。

张江现在可以用他的超能力去拯救世界，他可以去帮助那些受害者，去打败恶势力，他可以实现他的英雄梦想，他可以成为一个真正的英雄。"
33,唐,瞬间移动,艰难,"

一位叫做林枫的唐朝英雄，他拥有着非凡的勇气和智慧，他曾经帮助唐朝将军击退了敌军，赢得了诸侯们的尊重。

然而，在一次叛乱中，林枫失去了生命。但是，他的灵魂却被一位神秘的老人所吸引，老人将林枫的灵魂穿越到了现代，并赋予他一种超能力——瞬间移动。

林枫利用这种超能力，帮助奥特曼一起对抗怪兽，他的精准的攻击和谨慎的战术，使他成为了战斗中的守护神，他帮助奥特曼成功击退了怪兽。

最后，林枫的灵魂被老人召唤回了唐朝，老人告诉他，他的任务完成了，他可以安心的回到唐朝，永远被人们铭记。

林枫回到了唐朝，他的精神永远被人们铭记，他成为了唐朝的一位英雄，他的传奇故事也将传承下去，流传千古。"
34,唐,瞬间移动,艰难,"

有一位叫做李晓明的英雄人物，他生活在唐朝时期。他勇敢，聪明，有着极强的战斗力，他曾参加过许多激烈的战斗，拯救过无数的人民。

一次，李晓明穿越到了现代，他发现自己拥有了一种超能力，可以瞬间移动。他发现，现代的世界也遭受着怪兽的侵害，百姓们正在受苦受难。于是，他决定加入奥特曼，一起抵抗怪兽的侵略。

李晓明与奥特曼一起，经历了许多艰难的战斗，他们凭借着自己的勇气和勇敢，一次次地打败了怪兽，拯救了百姓。最后，他们成功地拯救了整个世界，给了人们希望。

李晓明的故事发生在唐朝时期，却流传至今，他也成为了一个传奇，他的精神将永远流传下去。"
35,唐,瞬间移动,艰难,"

一位叫做张天的英雄人物，生活在唐朝时期，他是一个勇敢的战士，常常去帮助穷苦的人们。

一天，他突然发现自己可以瞬间移动，拥有超能力，他开始利用这个能力去帮助他所熟悉的人，他也经常去拯救受困的人们。

有一次，他发现一群怪兽正在攻击一座城市，他决定去拯救城市里的人们。他瞬间移动到了现代，在那里他遇到了奥特曼，他们一起合作，帮助城市里的人们抵抗怪兽的攻击。

张天和奥特曼一起用他们的超能力，把怪兽赶跑了。最终，他们成功地拯救了城市，城市的人们都为他们的英勇行为而感激不尽。

张天最终回到了他原本的时代，他把自己在现代所学到的知识带回了唐朝，他成为了一位智慧的领袖，带领着人们走向繁荣富强。"
36,唐,不死之身,轻松,"

唐朝时期，有一位英雄人物叫做小黄，他拥有着超乎常人的武功，像神一般，被人们称为“小黄英雄”。

一天，小黄在一次练功的时候，突然被一股神秘的力量吸引，他穿越了时空，来到了现代。

小黄发现自己拥有了不死之身的超能力，他可以轻松地击败任何敌人。

一次，小黄穿越到了一个怪兽出没的世界，他发现这里正受到怪兽的攻击，只有奥特曼在维护这里的和平。

小黄决定帮助奥特曼，于是他们一起出发，开始了一场英雄的冒险。

小黄和奥特曼一起取得了最终的胜利，他们击败了怪兽，拯救了这个世界。

小黄在这次冒险中学到了很多，他明白了什么是真正的勇气与责任，他也明白了什么叫做“英雄”。

小黄最终回到了自己的时代，他以更加成熟的态度，继续成为一位英雄人物，为人类作出更多的贡献。"
37,唐,不死之身,轻松,"

那是一个晴朗的早晨，大空中翻滚着白色的云朵，洒下一片灿烂的阳光。一位古代唐朝的英雄人物突然出现在这片空旷的荒原上。他身穿一袭白衣，长发飘飘，一脸沧桑，犹如仙子般的存在，令人惊叹。

这位古代英雄叫做“陆游”，他宣称自己是唐朝时期的英雄，可以穿越时空，来到现代，拥有了不死之身这样的超能力，可以轻松地击败任何敌人。

没过多久，一群怪兽出现在这片荒原上，它们想要破坏这片土地，他们毁坏了房屋，抢劫了行人，制造了一片恐慌。

此时，陆游突然出现，他用自己的超能力击败了怪兽，让这片土地重新恢复了宁静。他又联手奥特曼，一起打败了怪兽，拯救了这片土地。

这一天，陆游从古代英雄变成了现代英雄，他带着自己的超能力，为百姓们做了一件又一件的好事，他也成为了民众心中的英雄。"
38,唐,不死之身,轻松,"

一位叫做李洛克的唐朝英雄，某天被一个神秘的穿越者带到了现代。李洛克混乱不安，不知道自己到了哪里，但被穿越者告知，他被送到了未来，还获得了不死之身的超能力。

李洛克在穿越者的帮助下，逐渐适应了现代生活，但他发现，这个世界正遭受着一种可怕的怪兽的攻击。李洛克想利用自己的超能力，来帮助这个世界，于是他加入了奥特曼的行列，与他们一起打败怪兽。

在奥特曼的帮助下，李洛克学会了如何使用自己的超能力，他发现，自己的超能力可以帮助他们更轻松地击败怪兽，他的超能力使他们的战斗更加有效率。

最后，在李洛克和奥特曼的共同努力下，怪兽被彻底击败了，世界得以恢复和平。李洛克也因此成为了当地人民的英雄，他的超能力也让他成为了一位传奇人物。"
39,唐,不死之身,努力,"

这是一个关于英雄的故事，他叫做李唐，出生于唐朝时期，他拥有一股英勇的精神，在唐朝时期，他为了保护国家，与强大的敌人作战，英勇的他在战斗中表现出色，但最终他还是被敌人打败了。

在他被敌人杀害之后，他的灵魂穿越到了现代，而他也拥有了不死之身，他能够拥有超能力，他可以利用自己的力量来帮助人们，打败邪恶的怪兽，保护世界的和平。

在他的帮助下，奥特曼和他的朋友们一起打败了怪兽，拯救了世界。他也因此成为了一个英雄，他的故事被人们传颂了起来。

李唐也因此成为了一位传奇的英雄，他的故事被人们永远记住，他的精神也将永远流传下去，让更多的人们能够感受到他的勇敢和坚毅。"
40,唐,不死之身,努力,"

李靖是唐朝时期的一位英雄人物，他有一种不死之身的超能力，可以穿越时空，穿越到现代。

李靖来到现代，发现这个时代被怪兽控制着，他决定要帮助奥特曼一起打败怪兽，于是他开始努力的训练，学习现代的武器，并且拥有了更强大的超能力。

李靖和奥特曼一起出发，他们先去打败了一个叫做蝙蝠怪兽的怪兽，他们用自己的武器和超能力，将蝙蝠怪兽打败了，大家都非常高兴。

接下来，李靖和奥特曼又去打败了一个叫做雷电怪兽的怪兽，他们用自己的武器和超能力，将雷电怪兽打败了，大家都非常高兴。

最后，李靖和奥特曼又去打败了一个叫做火焰怪兽的怪兽，他们用自己的武器和超能力，将火焰怪兽打败了，终于拯救了这个时代。

当李靖和奥特曼一起回到家的时候，人们都热烈的欢迎他们，他们成功的拯救了这个时代，大家都为他们鼓掌。

李靖穿越时空，来到了现代，通过努力的战斗，帮助奥特曼一起打败了怪兽，他成为了一位英雄，被人们永远铭记。"
41,唐,不死之身,努力,"

这是一个关于英雄的故事，他叫做周瑜。他是唐朝时期的一位英雄，他曾经征服了许多强大的敌人，被誉为“英雄”。

一次，周瑜被一位神秘的老人抓住了，老人告诉他，他可以穿越到现代，获得不死之身的超能力。周瑜毫不犹豫地接受了这个机会，穿越了时空，来到了现代。

穿越到现代后，周瑜发现，世界上出现了一批可怕的怪兽，他们想要毁灭人类，周瑜决定与奥特曼一起，去打败这些怪兽。

周瑜和奥特曼一起，经过激烈的战斗，最终击败了怪兽，拯救了人类，他也因此被誉为“英雄”。

最后，周瑜把他的不死之身的超能力，传授给了一群勇敢的年轻人，他们将继续保护世界，保护人类，守护和平。

这就是周瑜的故事，一个有着不死之身的英雄，他穿越到现代，和奥特曼一起打败了怪兽，拯救了人类，守护着世界的和平。"
42,唐,不死之身,艰难,"

古时候，唐朝有一位叫陆游的英雄人物，他拥有一身强大的武功，曾经参加过许多次大战，帮助唐朝维护了社会的安定。

但是，在一次战斗中，陆游被一种神秘的力量所吸引，他竟然穿越到了现代，发现自己拥有了不死之身这样的超能力。

陆游开始在现代这片大地上游荡，他发现这里满是恶势力，他们想要控制这片大地，而陆游决定要以自己的力量拯救这个世界。

于是，陆游和奥特曼一起，展开了一场惊心动魄的战斗，他们凭借自己的勇敢和智慧，最终打败了邪恶的怪兽，拯救了这个世界。

最后，陆游把自己的不死之身还给了神灵，他回到了古代，成为了一位传奇的英雄人物，他的故事也成为了一个永恒的传说。"
43,唐,不死之身,艰难,"

故事发生在唐朝。一位叫李靖的勇士，他是一位英勇的英雄，他为国家和人民做出了巨大的贡献。

有一天，李靖被一个神秘的力量吸引到了一个神秘的洞穴里，在那里他看到了一个古老的石像，上面有一句神秘的话：“英雄，你将成为不死的！”李靖觉得有点奇怪，但他决定接受这个挑战。

接下来的一年里，李靖每天都在洞穴里练习，终于，他掌握了一种超能力，他可以不死！他变得更加强大，而且他也可以控制时间和空间，可以在瞬间穿越到任何一个时空。

一天，李靖突然被召唤到了现代，在那里，他发现了一个可怕的怪兽正在破坏着城市，他立刻决定要去拯救这座城市。于是，他和奥特曼一起，展开了一场激烈的战斗。最后，他们凭借着他的超能力，终于战胜了怪兽，拯救了城市。

李靖回到了唐朝，他的勇敢和智慧被永远铭记在人们的心中。他成为了一个英雄，被人们永远铭记。"
44,唐,不死之身,艰难,"

一位叫做林木的唐朝时期的英雄人物，因为一次意外，穿越到了现代。林木来到了一个陌生的世界，他发现自己拥有了不死之身这样的超能力。

林木发现，在这个世界上，怪兽正在破坏着人类的生活，他决定要用自己的力量去帮助奥特曼一起消灭这些怪兽。于是，林木和奥特曼开始了他们的冒险之旅。

他们在一次次艰苦的战斗中，不断磨练自己的技能，把怪兽一个个击败，最终拯救了人类。他们的英勇行为受到了世人的称赞，而林木也成为了一位传奇的英雄。

林木又回到了自己的时代，他记得自己在现代的冒险，也记得他所受到的赞誉，他把这些经历都记录在一本书里，留给后人，让他们也能感受到他的英勇。"
45,唐,喷火,轻松,"

这位英雄人物叫做李明，他是唐朝时期的一名武士，他有着出色的武艺和勇敢的精神，他曾参与过许多著名的战役，他的英勇表现赢得了众多同胞的赞誉。

一天，李明突然发现自己穿越到了现代，他非常吃惊，但他也发现自己有了一种超能力，可以喷出火焰。他开始研究自己的能力，发现他可以使用这种能力来帮助他人。

没多久，他就被召唤去帮助奥特曼一起对抗怪兽。他一边利用自己的喷火能力，一边使用他在唐朝时期学到的武艺，在战斗中发挥出色。最后，他和奥特曼一起打败了怪兽，保护了人们的安全。

李明回到了唐朝时期，他的经历和他拥有的超能力让他更加出色，他的英勇表现让他在史书中永垂不朽。"
46,唐,喷火,轻松,"

这是一个关于唐朝的传奇故事。一位英雄人物，他叫陈家兴，是唐朝最伟大的武士之一。他拥有超凡的能力，可以把自己穿越到现代，并获得了喷火的超能力。

他来到了现代，发现这个时代的人们被怪兽所威胁，他立刻决定要去帮助他们。于是，他和奥特曼一起投入战斗，用他的喷火超能力，一起把怪兽打败了。

在这场战斗中，陈家兴表现出了超凡的勇气和勇敢，他用自己的力量，帮助奥特曼拯救了这个时代的人民。最终，怪兽被击败，这个时代的人民得以安宁，陈家兴也回到了他的唐朝时代。

这是一个关于伟大英雄的传奇故事，陈家兴用自己的力量，帮助奥特曼拯救了这个时代，这个传奇将永远流传下去。"
47,唐,喷火,轻松,"

这是一个关于唐朝英雄的传奇故事，他叫高山。他是一个勇敢的战士，拥有超自然的力量，能够喷出烈焰，拥有强大的攻击力。

一天，高山正在森林中漫步，突然发现一个神秘的光环，他不知道这是什么，但他觉得有一股神秘的力量在吸引他，他走了进去，突然，他发现自己被传送到了一个陌生的世界，这里是现代的世界，高山感到非常惊讶。

他在这个世界里发现了自己拥有的超能力，他可以喷出烈焰，拥有强大的攻击力。他也发现这个世界里有很多怪兽，他们正在攻击人类，高山决定要帮助人类，他和奥特曼一起打败了怪兽，拯救了这个世界。

最后，高山回到了自己的时代，他变得更加勇敢和坚强，他的英雄事迹也传遍了世界，人们都把他当作一位英雄，永远记住了他的传奇故事。"
