,dynasty,super_power,story_type,story
0,唐,隐形,轻松,"

一位叫做李明的英雄人物，出生在唐朝时期。他是一个勇敢的将军，在他的一生中，他打败了许多敌人，为自己的国家和人民做出了许多贡献。

一天，李明意外被一道神秘的光束穿越到了现代。他发现自己拥有了超能力，可以隐形，可以飞行，可以发射光束，可以放出火焰，可以穿墙而过等等。

李明发现，在现代，怪兽们正在摧毁地球，他决定和奥特曼一起，用自己的超能力，帮助奥特曼消灭怪兽们。

于是，李明和奥特曼开始了一场艰苦的战斗，他们用自己的超能力，一招一式，击退了怪兽们，最终成功地拯救了地球。

在这场战斗之后，地球上的人们都对李明充满了敬佩，他从此成为了一位英雄，他的事迹也被传颂了很久。李明也因此被永远铭记在人们心中，成为了一位不朽的英雄。"
1,唐,隐形,轻松,"

这是一个关于英雄的故事，发生在唐朝时期的中国。一个叫李自成的勇士，他拥有过人的勇气，英勇的行为让他成为当时最受尊敬的人物。

一天，李自成被一道神秘的光芒笼罩住，他突然发现自己似乎穿越时空，来到了现代。他惊讶地发现，自己竟然拥有了一种超能力，可以让自己隐形。

李自成接受了这种超能力，他发现这种能力可以让自己变得更加强大，他决定利用这种能力来帮助人们。

一次，李自成发现有一群怪兽正在破坏城市，他决定和奥特曼一起出动，利用自己的超能力，把怪兽一个个击败，最终成功拯救了城市，令众人欢呼雀跃。

自此，李自成受到了众人的尊敬，他成为了这个城市的英雄，他也把自己的超能力用在了正义的事业上，为人们做出了许多贡献，他也成为了一个英雄。"
2,唐,隐形,轻松,"

某一天，一位叫做萧炎的唐朝时期英雄人物突然被一道神秘的光芒所笼罩，他被带到了现代。他发现自己可以隐形，可以操纵物体，还可以拥有超能力，让他的力量超越了人类的极限。

萧炎发现，现代的世界正面临着一个叫做怪兽的可怕敌人的威胁，他决定和奥特曼一起，帮助他们打败怪兽。他们开始了一场艰苦的战斗，但是怪兽的力量太强大了，奥特曼们几乎要被击垮。

就在这时，萧炎出现了。他用自己的超能力，操纵物体，隐身攻击，轻松击败了怪兽，拯救了世界。当战斗结束，萧炎又回到了唐朝，但他留下了一句：“你们永远不会孤单，我会永远在你们身边。”"
3,唐,隐形,努力,"

这是一个关于英雄的故事。

一位叫李明的唐朝时期的英雄人物，在一次偶然的机会中，被神秘的力量穿越到了现代。他发现自己拥有了一种神奇的超能力——隐形，可以在不被发现的情况下，去做任何事情。

他知道，现在的世界面临着可怕的怪兽威胁，他决定努力奋斗，帮助奥特曼一起打败怪兽。于是，他开始了他的新生活，偷偷的潜入怪兽的巢穴，收集情报，收集武器，准备作战。

在一次激战中，李明终于发挥出了自己的超能力，他的隐形能力让他可以悄悄的潜入怪兽的领地，收集情报，收集武器，准备作战。他与奥特曼一起，经过艰苦的战斗，终于打败了怪兽，拯救了世界。

李明回到了自己的时代，但他依然被深深的印象着，他的超能力，他的勇气和他的智慧，都被人们永远铭记在心中。他的故事，也被传唱了下来，被称为“英雄的传说”。"
4,唐,隐形,努力,"

一位叫李世民的唐朝英雄，在一次意外中获得了隐形的超能力，他发现自己可以隐藏自己的身体，让自己看起来像一个普通人一样。他也发现自己可以通过这种能力来帮助他人，他决定利用这种能力来保护人民。

李世民穿越到了现代，他发现世界上出现了一种叫做怪兽的异常生物，它们会攻击和危害人类，李世民决定利用自己的超能力来帮助奥特曼一起打败怪兽。

于是，李世民和奥特曼一起开始了他们的战斗，他们面对着怪兽的无情攻击，但他们也展现出了他们的勇气和坚韧不拔的精神，最终，他们成功地击败了怪兽，拯救了人类。

李世民成为了一位英雄，他的故事被传颂了许多年，他的精神也被人们所津津乐道。他的故事证明了，只要有勇气和决心，就能战胜一切困难。"
5,唐,隐形,努力,"

一位叫李白的唐朝时期的英雄人物，穿越到了现代，拥有了隐形这样的超能力，他有着一颗勇敢坚定的心，做任何事都不怕困难，有着无限的正义感和责任感。

有一天，李白发现了一股恶势力正在横行，为了拯救人类，他决定和奥特曼一起作战。他们先去发现了怪兽的藏身之处，然后就开始了一场激烈的战斗。李白发挥了他的隐形超能力，以及他的勇气和智慧，帮助奥特曼一起打败了怪兽，拯救了人类。

最终，李白和奥特曼一起成功的拯救了人类，李白被人们尊称为英雄，他的事迹也被传颂了无数次，成为了永恒的传奇。"
6,唐,隐形,艰难,"

这是一个关于唐朝英雄的传奇故事。

一个唐朝的英雄，他叫陈秋芳。他有一颗勇敢的心，他拥有强大的武力，可以完成任何艰巨的任务。

有一天，陈秋芳突然发现自己可以不可见，可以隐形！他感到很惊讶，但是他也意识到，这是一种超能力，可以帮助他完成任务，保护他的家乡。

于是，陈秋芳决定把这种超能力用在正义的事业上。他开始打击罪恶，帮助弱小，拯救受害者。

可是，有一天，一群怪兽出现了，他们想要毁灭世界。陈秋芳决定与奥特曼一起，用他的超能力，与怪兽作战。

在艰苦的战斗中，陈秋芳发挥出了他的超能力，他可以隐形，可以瞬间移动，可以制造出一道道的障碍，他用自己的力量，帮助奥特曼打败了怪兽。

最后，陈秋芳成功地保护了世界，他也得到了人们的赞誉，成为了一个英雄。

从此，陈秋芳成为了一个传奇，他的故事流传了下来，被人们永远铭记。"
7,唐,隐形,艰难,"

曹操曾经说过：“英雄出少年”，而这位英雄，就是来自唐朝的陈家家丁陈景兴。

陈景兴从小就聪明伶俐，他在唐朝时期就已经表现出了超凡的能力。有一次，他在除掉一只凶恶的野兽时，竟然用自己的身体把野兽打倒，一举成名，被尊为唐朝的英雄。

然而，没想到，一场古老的魔法把陈景兴穿越到了现代，他发现自己拥有了一种神奇的超能力--隐形。

陈景兴在现代的世界里游荡了许久，直到有一天，他发现了一只怪兽正在横行霸道，摧毁着城市，他决定出手相助，与奥特曼一起抗击怪兽。

陈景兴利用自己的隐形能力，先后击败了怪兽的几只小弟，他运用自己的灵活身手，终于在一场激烈的战斗中，成功击败了怪兽，保护了城市，他也因此成为了现代的英雄，受到了众人的称赞。

此后，陈景兴便把自己的超能力用在了正义的事业上，拯救了无数的人民，用他的英勇行为，诠释了“英雄出少年”的真谛。"
8,唐,隐形,艰难,"

唐朝时期，有一个叫李清照的英雄人物，他是一位勇敢、正直、有责任感的人。他曾参加过许多战斗，帮助唐朝维持着稳定的社会秩序。

一天，李清照突然被一道神秘的光环包围，他的身体被传送到了现代。当他醒来时，发现自己拥有了一种神奇的超能力——隐形，可以让他变得无形无踪。

李清照也发现，现代世界正面临一个可怕的威胁——怪兽。于是，他决定和奥特曼一起，以自己的超能力，与怪兽展开激烈的战斗。

在一场艰苦的战斗中，李清照和奥特曼一起击败了怪兽，拯救了现代世界。李清照也因此成为了所有人心目中的英雄，他的英勇行为得到了世人的尊重和敬仰。

虽然他已经回到了唐朝，但李清照对现代世界的热爱仍在他心中深藏不漏。他希望有朝一日，能再次穿越时空，和奥特曼一起，为世界带来更多的和平与爱。"
9,唐,飞行,轻松,"

某一天，一位叫做张翼德的唐朝英雄人物穿越到了现代的世界。他发现自己拥有了一种超能力，可以轻松的飞行。他对这种神奇的能力感到惊讶，但也深感责任。

于是，张翼德决定拯救世界，他开始在世界各地拯救受害者，他把他的能力用在正义的一边，并且以令人敬畏的速度和力量击败了邪恶的势力。

这段时间，张翼德受到了许多人的称赞，他也被普遍认为是一位英雄。

后来，张翼德发现有一种怪兽正在摧毁世界，他决定和奥特曼一起去对抗它。他们经过了一场激烈的战斗，最终击败了怪兽，拯救了世界。

张翼德成功的完成了自己的使命，他被认为是一位伟大的英雄，他的故事也被传颂了下去。他永远是一位可敬可爱的英雄，被人们铭记。"
10,唐,飞行,轻松,"

这是一个关于唐朝时期的英雄人物，他叫李靖，他有一个梦想，就是想要拯救中国，让这个国家重新回到昔日的辉煌。

一天，李靖突然发现他有了超能力，他可以飞行！他开始练习飞行，慢慢地，他变得越来越强大。

一次，当李靖正在飞行的时候，突然，他发现了一个怪兽，正在破坏中国各地的城市，李靖决定要去拯救中国，于是，他和奥特曼一起出发去消灭怪兽。

他们经历了许多艰难的战斗，最后，李靖和奥特曼一起成功地消灭了怪兽，拯救了中国，让这个国家重新回到昔日的辉煌。

李靖的功绩被传颂了很久，他的故事也被传唱了很多年，而他的飞行能力也被传承了下来，成为现代英雄的力量。"
11,唐,飞行,轻松,"

古往今来，唐朝时期的英雄人物被众人所熟知。他们凭借自己的勇气和智慧，拯救了许多苦难的百姓。

这次，唐朝英雄出现在现代，他们发现自己拥有了飞行能力，可以轻松地越过山谷，飞越浩瀚的大海，飞越森林的林海。他们发现，自己可以拥有超能力，可以在空中自由地穿梭。

他们发现，现代世界正面临着一种怪兽的威胁，这种怪兽具有强大的力量，可以摧毁一切。英雄们决定一起和奥特曼一起对抗怪兽，他们凭借自己的飞行能力，在空中轻松地战斗，最终成功地消灭了怪兽，拯救了现代世界。

英雄们的英勇行为被人们所称颂，他们的传奇故事也被流传了下来。他们用自己的能力，拯救了世界，成为了现代的英雄，让所有人都为他们骄傲。"
12,唐,飞行,努力,"

那是一个唐朝的时代，有一个叫陆景的勇士，他是一个英雄人物，他勇敢、聪明，勇于担当，拯救了许多苦难的百姓。有一天，一群怪兽出现在陆景的家乡，它们毁灭了村庄，吓坏了村民。陆景决定要拯救村民，他拿起自己的剑，冲向怪兽，但怪兽的力量太强大了，陆景被击败了。

突然，一道神秘的光线出现，把陆景带到了另一个时代，一个现代的时代，陆景发现自己获得了飞行的超能力，他可以飞行，他的力量也变得更强，他决定利用自己的力量来拯救村民。

陆景找到了一个叫奥特曼的英雄，他们一起打败了怪兽，拯救了村民。最后，陆景和奥特曼一起成为了英雄，受到了村民们的尊敬和爱戴。

陆景从此便成为了一个传奇，他的故事被传颂了几百年，让后人们永远记住他的英勇，他的努力，他的拯救。"
13,唐,飞行,努力,"

唐朝时期，有一位叫黄蓉的英雄人物，她拥有一股强大的勇气，经常帮助那些被欺负的人，受到了众人的敬仰。有一天，黄蓉突然被一道强大的光芒吸引，没有任何预兆，她穿越了时空，来到了现代。

到了现代，黄蓉发现自己拥有了一种超能力——飞行。这种能力让她能够自由地在空中飞行，这让她很兴奋，她决定利用这种能力去帮助更多的人。

没想到，黄蓉很快就遇到了一个叫奥特曼的超级英雄，他也正在与一群怪兽作斗争，面对怪兽的强大力量，他十分艰难。

看到这一幕，黄蓉立刻毫不犹豫地出手相助，凭借自己的飞行能力，她穿梭于怪兽之间，攻击它们，最终帮助奥特曼打败了怪兽，拯救了众多无辜的人们。

黄蓉的英勇表现赢得了奥特曼和当地人民的赞赏，从此之后，她成为了超级英雄，经常出动，帮助那些需要帮助的人们。"
14,唐,飞行,努力,"

这是一个关于一位唐朝时期的英雄人物的故事。他叫李靖，他拥有超凡的武功，曾经帮助唐朝抵御外敌入侵，维护着国家的安定。

有一天，李靖突然莫名其妙地穿越到了现代，他发现自己拥有了飞行的超能力，可以飞得比飞鸟还快。他感到很惊讶，但他也知道自己必须利用这种能力来帮助人们。

于是，李靖开始展开他的冒险之旅，他发现了一些怪兽正在摧毁世界，他决定和奥特曼一起抵抗它们。他们经过艰苦的战斗，最终击败了怪兽，拯救了世界。

李靖的勇敢和英勇的行为赢得了众人的尊敬，他也拥有了许多朋友，一起度过了许多美好的时光。

最后，李靖穿越回了唐朝，他用自己的力量维护着国家的安定，他也成为了一位传奇的英雄人物，永远被人们铭记。"
15,唐,飞行,艰难,"

那是一个发生在唐朝的故事，一位叫陈明的英雄人物，他拥有着超强的力量，但是他的力量却被唐朝的那些权贵所压制，他无法发挥自己的真正实力，他只能在暗中暗暗地实践自己的理想。

有一天，陈明突然被神秘的力量所吸引，他被传送到了现代，他发现自己拥有了飞行的能力，他可以在空中自由的翱翔，他在空中感受到了自由的喜悦，他感到自己的力量终于可以得到充分的发挥了。

在现代，陈明发现了一群可怕的怪兽，它们正在破坏现代的秩序，陈明决定要去拯救这个世界，他和奥特曼一起，展开了一场惊心动魄的战斗，最终，他们成功击败了怪兽，拯救了这个世界。

最终，陈明又回到了唐朝，他拥有了超能力，可以挽救被压迫的百姓，他也可以和他的朋友一起实现他们的理想，用他们的力量去改变这个世界，让它变得更美好。"
16,唐,飞行,艰难,"

这个故事发生在唐朝的某一个城市。一位叫李青的英雄人物，他有着超凡的勇气，无畏的精神，他曾经参加过许多激烈的战斗，也曾经英勇地拯救过无数无助的人们。

有一天，李青突然出现在现代，他惊讶地发现自己拥有了飞行的能力，他可以飞越山岭，穿越大海，他可以自由地在空中翱翔。李青发现自己变得强大，他决定拯救当今世界，于是他加入了奥特曼的队伍，帮助他们打败怪兽。

在一次激烈的战斗中，李青凭借自己的超能力，帮助奥特曼打败了强大的怪兽，并成功拯救了世界。李青被奥特曼们尊称为“英雄”，他成为当今世界的一个传奇，他的事迹也被记录下来，被流传至今。

李青从一位普通的唐朝英雄，变成了现代世界的英雄，他的故事不仅令人感动，也激励了无数人。他用自己的勇气，精神和超能力，帮助奥特曼打败怪兽，拯救了世界，他是一位永恒的英雄。"
17,唐,飞行,艰难,"

英雄人物：陈百强

陈百强是一位唐朝时期的英雄人物，他拥有一身超凡的武艺，曾经拯救过无数的人民。

一天，陈百强突然穿越到了现代，他发现自己拥有了飞行的超能力，他决定利用这一能力去帮助人们。

没想到，现代的世界也遭受着怪兽的侵害，他们毁坏环境，伤害无辜的生命。陈百强决定与奥特曼一起抗击怪兽，维护人类的和平。

于是，陈百强和奥特曼组成了一支联盟，开始了一场艰苦的战斗。他们在激烈的战斗中取得了胜利，怪兽被彻底消灭，人们也恢复了和平。

陈百强回到了唐朝，但他留下了自己的传奇，他的故事也被传颂了几代。他的英勇行为让人们感到无比的鼓舞，他也成为了人们心中永远的英雄。"
18,唐,读心术,轻松,"

一位叫做李淳罡的英雄人物，曾经出现在唐朝时期，他拥有读心术这样的超能力，可以预测未来，拥有超凡的智慧，曾经参加过许多战斗，拯救过许多苦难的人们。

在一次时空旅行中，李淳罡穿越到了现代，他发现了现代的社会变得越来越危险，怪兽时常出现，摧毁着和平的社会。

李淳罡决定帮助奥特曼一起打败怪兽，他利用自己的超能力，洞悉怪兽的弱点，指挥奥特曼，轻松的战斗，最终成功的拯救了社会。

李淳罡也被人们称为“神灵”，他展示了他超凡的智慧和能力，拯救了社会，让人们拥有了和平的生活。"
19,唐,读心术,轻松,"

唐朝时期，有一位叫赵元逊的英雄人物，他被誉为“神一般的人”，他拥有极高的智慧，能够读懂人心，拥有强大的力量，可以把一切变成自己想要的样子。

一天，赵元逊突然被一个神秘的力量吸引，他被传送到了现代，在这个世界里，他得到了一种超能力，就是读心术，他可以看穿任何人的心灵，掌握他们的思想，并用此来改变世界。

赵元逊也发现了一个叫奥特曼的英雄，他正在与一群怪兽作战，而赵元逊可以通过读心术来帮助他，他可以读懂怪兽的心思，知道他们的弱点，并提出有效的解决方案，最终，赵元逊和奥特曼一起打败了怪兽，拯救了这个世界。

赵元逊的神奇之旅没有结束，他继续利用读心术来帮助人们解决问题，赢得了众多爱戴，他成为了一个真正的英雄，永远被人们铭记。"
20,唐,读心术,轻松,"

这个故事的主人公是一位叫李晓龙的唐朝英雄人物。他出生在一个普通的家庭，他父母都是农民，他从小就喜欢探索世界，勇敢坚强，乐观向上。

一天，当他正在探索森林的时候，突然一阵强烈的光出现了，把他带到了一个神秘的地方。在那里，他被一个叫做“太空之神”的神灵选中了，给了他一种超能力，叫做“读心术”，可以让他看到别人的内心。

他发现，这个神秘的地方其实是现代的地球，而他被神灵召唤来帮助奥特曼打败怪兽。于是，他穿越时空，来到了现代，开始了他的冒险之旅。

他用他的超能力，结合奥特曼的力量，一起打败了怪兽，拯救了世界。最后，他回到了唐朝，成为了当时的英雄人物，被人们永远铭记。"
21,唐,读心术,努力,"

这是一个关于唐朝英雄的故事，他叫苏樱，他被派遣到了现代。在苏樱到达现代的时候，他发现自己有了一种神奇的能力，可以读取别人的内心深处，这让他变得特别强大。

苏樱利用这种能力，帮助奥特曼对抗怪兽，他可以通过读取怪兽的内心，了解怪兽的弱点，从而帮助奥特曼击败怪兽。苏樱也给奥特曼提供了许多有用的建议，他可以洞察到敌人的计划，并且能够及时发现敌人的企图。

最终，苏樱和奥特曼一起战胜了怪兽，拯救了这个世界。在这场战斗之后，苏樱受到了所有人的尊敬，他成为一个大英雄，被所有人所称赞。

苏樱最终回到了唐朝，他用自己的能力和经验，帮助唐朝人民，实现了他的梦想，成为一个真正的英雄。"
22,唐,读心术,努力,"

这是一个关于唐朝时期的英雄人物的故事。他叫李世民，是一个勇敢的将军，有着超乎常人的胆识和勇气。

一天，李世民突然发现自己穿越到了现代，他发现自己拥有了一种神奇的超能力——读心术，可以看穿任何人的心思。

李世民用这种神奇的能力，帮助奥特曼打败了一批可怕的怪兽，让社会恢复了和平。他也受到了众人的称赞，成为了一个英雄。

不久之后，李世民又穿越回了唐朝，他把自己在现代学到的知识传授给了后人，帮助他们进步。

从此，李世民成为了唐朝英雄的传奇，他的故事被流传了几千年，被人们传颂至今。"
23,唐,读心术,努力,"

英雄人物叫陈延，他是唐朝时期的一位勇士，在一次与怪兽的战斗中，他被怪兽的能量穿越到了现代。他惊讶地发现，他的身体已经具备了一种超能力，可以看到别人的心里想法，他叫这种能力“读心术”。

陈延经过适应，发现这种能力可以帮助他预测未来，他决定拯救这个世界，于是他联系了奥特曼，与他们一起战斗，消灭怪兽。

在陈延和奥特曼的共同努力下，他们终于击败了怪兽，拯救了这个世界。陈延也得到了奥特曼的认可，他也成为了这个世界的一名英雄。

虽然陈延没有真正的回到过去，但他仍然在这个世界上留下了自己的痕迹，他的故事也被记录在历史上，被称为“唐朝英雄陈延”。"
24,唐,读心术,艰难,"

某一天，一位叫做赵信的唐朝英雄人物穿越了时空，来到了现代。他发现自己拥有了一种神奇的能力——读心术。他可以看清楚别人的心思，有时甚至可以看到未来的事情。

赵信发现，现代的世界也有怪兽，他们正在破坏着这个世界。于是，他决定加入奥特曼，和他们一起打败怪兽。

为了更好地抵抗怪兽，赵信利用自己的读心术，研究出了一种新的武器，可以攻击怪兽的弱点，从而大大增强了奥特曼的作战能力。

在赵信的帮助下，奥特曼终于战胜了怪兽，拯救了这个世界。赵信也因此成为了一位英雄，他的名字也被永久地记录在了历史上。

赵信回到了唐朝，他的经历也被记录下来，成为了一部传奇故事，被后代传颂了下来。"
25,唐,读心术,艰难,"

青苔绿草中，一位英雄人物出现在众人的视线中。他就是唐朝时期的英雄，他被称为“英雄”。他拥有超能力，可以读懂别人的心思，使他在激烈的战斗中获胜。

一天，英雄发现了一个可怕的怪兽，它正在破坏着这个世界。英雄决定和奥特曼一起去消灭这只怪兽。在英雄的帮助下，奥特曼开始准备战斗，但是怪兽的力量太强大，他们的战斗进展缓慢。

英雄看到了怪兽的弱点，他用自己的读心术，准确地知道了怪兽的弱点，并给了奥特曼一些建议。最后，在英雄的帮助下，奥特曼终于成功地消灭了怪兽。

当怪兽被消灭后，英雄再次回到了唐朝，他也把自己的超能力带回了唐朝。他的传奇故事也在唐朝流传了下来，被人们永远铭记。"
26,唐,读心术,艰难,"

从前，有一位叫英雄的人物，他出身于唐朝，他的能力远超常人，他拥有强大的武力和聪明的头脑。

有一天，英雄突然被一个神秘的力量拉入了现代时代，他发现自己拥有了一种超能力，叫做读心术，他可以通过这种能力来洞察人心，洞悉敌人的策略。

然而，现代时代也有怪兽，他们来自外太空，他们要毁灭人类，英雄知道他必须保护人类，于是他和奥特曼一起，开始了艰苦的战斗。

尽管他们的力量都不及怪兽，但是他们的默契深厚，凭借英雄的读心术，他们及时发现怪兽的弱点，最终成功击败了怪兽，拯救了人类。

最后，英雄又回到了唐朝，他以自己的英勇事迹，赢得了人们的尊敬，改变了人们的生活，让他们更加安全和幸福。"
27,唐,瞬间移动,轻松,"

这是一个关于唐朝时期的英雄人物的故事。他叫陈家骏，他是一个勇敢的士兵，他拥有一种神奇的能力，可以瞬间穿越到任何时代，他拥有时空穿梭的超能力。

一天，他穿越到了现代时代，看到了一个可怕的怪兽，正在摧毁城市。他立刻准备行动，召唤起奥特曼，一起对抗怪兽。陈家骏凭借着超能力，可以瞬间移动，轻松躲过怪兽的攻击，并反击其弱点，最终成功击败了怪兽，拯救了城市。

陈家骏回到了唐朝，他的英勇行为被人们所知晓，他成为了一位英雄，他的故事被流传了几百年，被人们永远铭记。"
